air_id,name,type,brief_description,coe_fed,complexity,tool_version,process_details,object_details,queue,shared_folders,shared_mailboxes,qa_handshake,preprod_deploy_date,prod_deploy_date,warranty_end_date,comments,documentation,modified,path
AIR-100,Customer Data Validation,Data Processing,Automated validation of customer data,COE,Medium,Python 3.9,Validates customer information across systems,Customer objects and billing details,CustomerDataValidation,\\shared\\automations\\customer,customer.validation@company.com,QA-2024-001,2024-01-15,2024-02-01,2025-02-01,Initial deployment successful,Confluence documentation,2024-03-15 10:30:00,\\processes\\customer\\validation.py
AIR-101,Invoice Processing Workflow,RPA,End-to-end invoice processing automation,FED,High,UiPath 2023.10,Processes invoices from receipt to payment,Invoice and vendor objects,InvoiceProcessing,\\shared\\finance\\invoices,finance.auto@company.com,QA-2024-002,2024-01-20,2024-02-15,2025-02-15,Performance improved 40%,SharePoint documentation,2024-04-10 14:20:00,\\processes\\finance\\invoice.xaml
AIR-102,Employee Onboarding,Workflow,Automated employee onboarding process,COE,Low,Power Automate,Automates new hire workflows,Employee and department data,EmployeeOnboarding,\\shared\\hr\\onboarding,hr.automation@company.com,QA-2024-003,2024-02-01,2024-02-20,2025-02-20,Reduced time to 1 day,Teams documentation,2024-05-20 09:15:00,\\processes\\hr\\onboarding.json
AIR-103,Network Monitoring System,Monitoring,Automated network monitoring and alerts,FED,High,Python + Nagios 4.4.6,Monitors network devices continuously,Network devices and metrics,NetworkMonitoring,\\shared\\it\\monitoring,network.team@company.com,QA-2024-004,2024-02-10,2024-03-01,2025-03-01,99.9% uptime achieved,GitLab documentation,2024-06-05 16:45:00,\\processes\\network\\monitoring.py
AIR-104,Compliance Reporting,Reporting,Automated regulatory compliance reports,COE,Medium,Power BI + Python 3.10,Generates compliance reports,Financial and transaction data,ComplianceReporting,\\shared\\compliance\\reports,compliance.team@company.com,QA-2024-005,2024-02-15,2024-03-10,2025-03-10,Zero violations achieved,OneDrive documentation,2024-07-01 11:30:00,\\processes\\compliance\\reporting.py
